企业名称,省份,矿种,来源,联系电话,官网,地址
赣州南康区马肚里颖茂建材有限公司,江西,砂岩,国家采矿登记系统,,,
辽宁凌源渤船玄武岩科技开发有限公司,辽宁,玄武岩,国家采矿登记系统,,,
达县赢川矿业有限公司高益煤矿,四川,,手动采集-政府公示,,,
达拉特旗广鸿商贸有限公司,内蒙古,建筑用砂,国家采矿登记系统,,,
连云港圣王矿泉水有限公司,江苏,矿泉水,国家采矿登记系统,,,
连云港弘大旅游发展有限公司,江苏,地热,国家采矿登记系统,,,
邻水县建芳竹木加工有限公司,四川,砂岩,国家采矿登记系统,,,
郑州市慧祥煤业有限公司,河南,,手动采集-政府公示,,,
郑州广贤工贸有限公司新丰煤矿,河南,,手动采集-政府公示,,,
郯城国有玉峰矿业有限公司,山东,建筑石料用灰岩,国家采矿登记系统,,,
鄂伦春自治旗森峰经贸有限责任公司,内蒙古,矿泉水,国家采矿登记系统,,,
鄂托克旗恒泰矿业有限公司,内蒙古,建筑石料用灰岩,国家采矿登记系统,,,
醴陵市春华空心砖有限公司,湖南,页岩,国家采矿登记系统,,,
重庆东方宾馆有限公司,重庆,地热,国家采矿登记系统,,,
重庆众享益商贸有限公司,重庆,建筑石料用灰岩,国家采矿登记系统,,,
重庆国瑞矿业有限公司,重庆,建筑用砂岩,国家采矿登记系统,,,
重庆市云阳县云交建材有限责任公司,重庆,建筑石料用灰岩,国家采矿登记系统,,,
重庆市正宇混凝土有限责任公司,重庆,建筑石料用灰岩,国家采矿登记系统,,,
重庆龙源矿业有限公司,重庆,建筑石料用灰岩,国家采矿登记系统,,,
金塔县金鑫锦东建材有限责任公司,甘肃,建筑用砂岩,国家采矿登记系统,,,
金川集团股份有限公司,甘肃,,手动采集-政府公示,,,
铜川市杨泉山矿业有限责任公司,陕西,铜矿,爬虫抓取,,,
铜川药王山生态水泥有限公司,陕西,铜矿,爬虫抓取,,,
锦屏县诚泰产业发展有限公司,贵州,饰面用板岩,国家采矿登记系统,,,
镇江江之源渔业科技有限公司,江苏,地热,国家采矿登记系统,,,
长宁红狮水泥有限公司龙头-硐底水泥石灰岩矿,四川,,手动采集-政府公示,,,
阜宁县金沙湖开发投资有限公司,江苏,地热,国家采矿登记系统,,,
阜康市双鑫砂石料有限责任公司,新疆,建筑用砂,国家采矿登记系统,,,
阜康市柏杨河砂石料厂,新疆,建筑用砂,国家采矿登记系统,,,
阜康晟鸿建材有限公司,新疆,建筑用砂,国家采矿登记系统,,,
阳泉煤业(集团)有限责任公司五矿,山西,,手动采集-政府公示,,,
阿克苏天山多浪有限责任公司四石场1号石灰岩矿,新疆,,手动采集-政府公示,,,
阿图什市盛腾建材有限公司,新疆,建筑用砂,国家采矿登记系统,,,
阿拉善盟嘉利达商贸有限责任公司,内蒙古,建筑用砂岩,国家采矿登记系统,,,
阿拉善盟蒙雪矿业有限责任公司,内蒙古,建筑石料用灰岩,国家采矿登记系统,,,
阿拉善盟鼎盛鸿通生态治理建设工程,内蒙古,建筑用砂,国家采矿登记系统,,,
陇南柳城新型墙体建材有限公司,甘肃,砖瓦用粘土,国家采矿登记系统,,,
陈巴尔虎旗洪润运输有限责任公司,内蒙古,建筑用石料(凝灰岩),国家采矿登记系统,,,
陕西中能煤田有限公司,陕西,煤炭,爬虫抓取,,,
陕西中能煤田有限公司袁大滩煤矿,陕西,煤炭,爬虫抓取,,,
陕西何家塔煤矿有限责任公司,陕西,煤炭,爬虫抓取,,,
陕西华源矿业有限责任公司,陕西,未知,爬虫抓取,,,
陕西双龙煤业开发有限责任公司,陕西,煤炭,爬虫抓取,,,
陕西双龙煤业开发有限责任公司双龙煤矿,陕西,煤炭,爬虫抓取,,,
陕西商山新材料科技有限公司,陕西,制灰用石灰岩,国家采矿登记系统,,,
陕西太白黄金矿业有限责任公司,陕西,金矿,爬虫抓取,,,
陕西太白黄金矿业有限责任公司太白金矿,陕西,,手动采集-政府公示,,,
陕西延长石油榆林煤化有限公司,陕西,煤炭,爬虫抓取,,,
陕西延长石油榆林煤化有限公司榆阳区可可盖煤矿,陕西,煤炭,爬虫抓取,,,
陕西有色榆林煤业有限公司,陕西,煤炭,爬虫抓取,,,
陕西有色榆林煤业有限公司榆阳区杭来湾煤矿,陕西,煤炭,爬虫抓取,,,
陕西正通煤业有限责任公司,陕西,煤炭,爬虫抓取,,,
陕西正通煤业有限责任公司长武县高家堡煤矿,陕西,煤炭,爬虫抓取,,,
陕西涌鑫矿业有限责任公司,陕西,未知,爬虫抓取,,,
陕西涌鑫矿业有限责任公司府谷县安山煤矿,陕西,煤炭,爬虫抓取,,,
陕西略阳龙核矿业有限公司,陕西,未知,爬虫抓取,,,
陕西略阳龙核矿业有限公司两河口钼钒矿,陕西,钼矿,爬虫抓取,,,
陕西略阳龙核矿业有限公司略阳县白石沟钼钒矿,陕西,钼矿,爬虫抓取,,,
陕西省瀚涌石英砂有限公司,陕西,建筑用砂,国家采矿登记系统,,,
陕西省自然资源厅关于府谷县三道沟乡常胜煤矿,陕西,煤炭,爬虫抓取,,,
陕西红石岩矿业有限责任公司,陕西,未知,爬虫抓取,,,
陕西红石岩矿业有限责任公司黄陵县红石岩煤矿,陕西,,手动采集-政府公示,,,
陕西能源赵石畔煤电有限公司,陕西,煤炭,爬虫抓取,,,
陕西能源赵石畔煤电有限公司赵石畔煤矿,陕西,,手动采集-政府公示,,,
陕西郭家河煤业有限责任公司,陕西,,手动采集-政府公示,,,
陕西银母寺矿业有限责任公司,陕西,未知,爬虫抓取,,,
陕西银母寺矿业有限责任公司凤县银母寺铅锌矿,陕西,铅锌矿,爬虫抓取,,,
陕西陕北矿业韩家湾煤炭有限公司,陕西,煤炭,爬虫抓取,,,
陕西陕煤澄合矿业有限公司,陕西,煤炭,爬虫抓取,,,
陕西陕煤澄合矿业有限公司王村煤矿,陕西,煤炭,爬虫抓取,,,
陕西陕煤澄合矿业有限公司董家河煤矿,陕西,煤炭,爬虫抓取,,,
陕西陕煤韩城矿业有限公司,陕西,煤炭,爬虫抓取,,,
隆化兴泰矿业有限公司,河北,膨润土,国家采矿登记系统,,,
隆回县金石湾建材有限公司,湖南,建筑石料用灰岩,国家采矿登记系统,,,
霍州煤电集团,山西,煤炭,爬虫抓取,,,
霍州煤电集团有限责任公司,山西,煤炭,爬虫抓取,,,
霍州煤电集团有限责任公司中峪煤矿,山西,煤炭,爬虫抓取,,,
青川县胖达矿业有限公司,四川,玻璃用砂岩,国家采矿登记系统,,,
青河县锦峰石材有限公司,新疆,饰面用辉绿岩,国家采矿登记系统,,,
青海兴远建设工程有限公司,青海,建筑用砂,国家采矿登记系统,,,
青海水泥股份有限公司,青海,水泥用石灰岩,国家采矿登记系统,,,
靖边县宏达砖厂,陕西,砖瓦用粘土,国家采矿登记系统,,,
靖边县杨家湾富鑫机砖厂,陕西,砖瓦用粘土,国家采矿登记系统,,,
额尔古纳市鑫易矿业开发有限公司,内蒙古,铅矿,国家采矿登记系统,,,
马关县永发矿业有限责任公司都龙镇大夹槽锡钨矿,云南,,手动采集-政府公示,,,
高县复源石材有限公司,四川,砂岩,国家采矿登记系统,,,
高台县金龙晟耀矿业有限公司,甘肃,冶金用石英岩,国家采矿登记系统,,,
黄陵县南川二号煤炭实业有限公司,陕西,煤炭,爬虫抓取,,,
黑龙江省华皓矿物开采有限公司,黑龙江,建筑用玄武岩,国家采矿登记系统,,,
湖南能源集团有限公司,湖南,煤炭,招聘信号-矿调度中心调度员在招,
锦江集团,印尼/全国,矿产,招聘信号-矿山车辆运输调度主管在招,
雅江县斯诺威矿业发展有限公司(宁德时代),四川甘孜,锂矿,招聘信号-自动化主管在招,
中国中煤能源集团,北京,煤炭,招聘信号-智能化转型中,
中煤科工集团智能矿山分公司,天津/鄂尔多斯,煤炭,招聘信号-算法+现场支持在招,
南京寒锐钴业股份有限公司,江苏南京,钴矿,招聘信号-IT系统工程师在招,
希尔威矿业,北京/海外,金矿,招聘信号-采矿管理在招,
宁夏润丰新材料科技有限公司,宁夏灵武,化工/矿产,招聘信号-车辆调度员在招,
新疆庆华丰能源有限公司,新疆伊宁,能源,招聘信号-生产总调度在招,
